,job_title,company_name,country,city,job_type,work_location,experience_level,yrs_exp,industry_and_skills,label
546,Loss Prevention Lead,Kintec Global Recruitment,Qatar,Doha,Full Time,Not Specified,Not specified,Not Specified,"Banking, Legal, Logistics/Supply Chain, Supply Chain, Logistics, Warehousing, Security &amp; Loss Prevention, Security, Security Management, CPP",2
547,Medical Representative,Abbott Healthcare Products Ltd,SaudiArabia,Riyadh,Full Time,Not Specified,Not specified,Not Specified,"Medical/Healthcare, Sales/Retail, Pharmaceutical, Sales, Sales Skills, Medical, Pharmacy, Sales Target, Science, Medical Sales",1
548,Risk Reporting Director,"Zakat, Tax and Customs Authority",SaudiArabia,Riyadh,Full Time,Not Specified,Manager,Not Specified,"Accounting/Finance, IT/Software Development, Sales/Retail, microsoft office, finance, accounting, engineering, computer science, management, administration",2
549,Zoho CRM Developer,TSK Global | Zoho Premium Partner,Egypt,Cairo,Part Time,Not Specified,Experienced,Not Specified,"IT/Software Development, Sales/Retail, Engineering - Telecom/Technology, Information Technology (IT), CRM, Computer Science, Software Development, C#, Engineering, javaScript",0
550,Product Manager - Marn,PrecisionHire Solutions,SaudiArabia,Riyadh,Full Time,Not Specified,Entry Level,Not Specified,"IT/Software Development, Marketing/PR/Advertising, Sales/Retail, Product Management, Marketing, Sales, Information Technology (IT), Computer Science, Project Management, Sales Skills",1
551,V.I.E - Business Analyst - Riyadh - Cartier,PrecisionHire Solutions,SaudiArabia,Riyadh,Full Time,Not Specified,Experienced,Not Specified,"IT/Software Development, Marketing/PR/Advertising, Engineering - Telecom/Technology, information technology (it), computer science, engineering, marketing, management, english, finance",0
552,Transportation Network AMP Manager,"IAP Worldwide Services, Inc",Qatar,Doha,Full Time,Not Specified,Not specified,Not Specified,"IT/Software Development, Logistics/Supply Chain, Engineering - Telecom/Technology, information technology (it), computer science, engineering, logistics, maintenance, management, repair",0
553,Transportation Network AMP Manager,Intrepid,Qatar,Doha,Full Time,Not Specified,Experienced,Not Specified,"IT/Software Development, Logistics/Supply Chain, Engineering - Telecom/Technology, information technology (it), computer science, engineering, logistics, maintenance, management, repair",0
554,Senior Revenue Assurance Specialist,Beyond ONE,SaudiArabia,Riyadh,Full Time,Not Specified,Experienced,Not Specified,"IT/Software Development, Quality, Engineering - Telecom/Technology, Quality Assurance, QA, Quality, Quality Control, Computer Science, Testing, Software Development",2
555,Zakat Compliance Specialist,Truelancer.com,SaudiArabia,Makkah,Full Time,Not Specified,Entry Level,Not Specified,"R&D/Science, Quality, Pharmaceutical, Quality, Compliance, Quality Assurance, Pharmaceutical, Quality Control, Science, GMP",2
556,Product Manager - Financial Horizon Services,PrecisionHire Solutions,SaudiArabia,Riyadh,Full Time,Not Specified,Experienced,Not Specified,"IT/Software Development, Marketing/PR/Advertising, Sales/Retail, Product Management, Marketing, Sales, Information Technology (IT), Computer Science, Project Management, Sales Skills",1
557,Intern- Strategic Consulting,JLL,UnitedArabEmirates,Dubai,Freelance / Project,Not Specified,Entry Level,Not Specified,"Accounting/Finance, IT/Software Development, Medical/Healthcare, Accounting, Commerce, Computer Science, Finance, Information Technology (IT), CIA, CPA",2
558,Principal Environmental Consultant,Ayesa,SaudiArabia,Riyadh,Full Time,Not Specified,Experienced,Not Specified,"IT/Software Development, Sales/Retail, Engineering - Telecom/Technology, Engineering, Computer Science, Information Technology (IT), Oracle, Project Management, Sales, 2G",0
559,Principal Solutions Architect (Saudi National),Dell Technologies,SaudiArabia,Riyadh,Full Time,Not Specified,Not specified,Not Specified,"Engineering - Construction/Civil/Architecture, IT/Software Development, Engineering - Telecom/Technology, Information Technology (IT), Computer Science, Engineering, Software Engineering, Software Development, Computer Engineering, Solution Architecture",0
560,Solution Consultant Middle East,Denodo,SaudiArabia,Riyadh,Full Time,Not Specified,Experienced,Not Specified,"Accounting/Finance, IT/Software Development, Sales/Retail, information technology (it), computer science, sales, accounting, management, architecture, english",1
561,Regional Sales Specialist-Cardiac Rhythm Management (CRM),Abbott,UnitedArabEmirates,Dubai,Full Time,Not Specified,Not specified,Not Specified,"Business Development, Marketing/PR/Advertising, Sales/Retail, sales, sales skills, sales target, customer service, marketing, medical, management",1
562,Senior Presales Consultant- Government- KSA,Giza Arabia,SaudiArabia,Riyadh,Full Time,Not Specified,Not specified,Not Specified,"IT/Software Development, Sales/Retail, Engineering - Telecom/Technology, Information Technology (IT), Sales, Computer Science, Sales Skills, Presales, Engineering, RFP",1
563,"Senior Specialist, Payroll",Ooredoo,Kuwait,Kuwait City,Full Time,Not Specified,Not specified,Not Specified,"Human Resources, Marketing/PR/Advertising, Media/Journalism/Publishing, Marketing, Human Resources (HR), Social Media, Microsoft Office, E-marketing, Digital Marketing, Media",2
564,"Senior Manager, Strategic Consulting, MENA","Jones Lang LaSalle IP, Inc",SaudiArabia,Riyadh,Full Time,Not Specified,Not specified,Not Specified,"Accounting/Finance, IT/Software Development, Logistics/Supply Chain, Information Technology (IT), SAP, Computer Science, Accounting, Finance, Supply Chain, Engineering",2
565,Senior Financial Analyst,VISA,UnitedArabEmirates,Dubai,Full Time,Not Specified,Not specified,Not Specified,"Accounting/Finance, IT/Software Development, Analyst/Research, Finance, Accounting, Financial Analysis, Information Technology (IT), Analysis, Computer Science, Business Analysis",2
566,Regulatory Affairs Associate,Novartis,SaudiArabia,Riyadh,Full Time,Not Specified,Entry Level,Not Specified,"Administration, Medical/Healthcare, Pharmaceutical, Pharmacy, Regulatory Affairs, Science, Pharmaceutical, Administration, Medical, Legal",2
567,Safety Culture Head,Applus+,Qatar,Doha,Full Time,Not Specified,Not specified,Not Specified,"Operations/Management, Quality, Engineering - Mechanical/Electrical, engineering, microsoft office, management, quality, science, production, safety",2
568,Research Manager / Senior Research Analyst - Real Estate,Quanterra Group,UnitedArabEmirates,Dubai,Full Time,Not Specified,Experienced,Not Specified,"Marketing/PR/Advertising, Project/Program Management, Analyst/Research, Research, Market Research, Marketing, Analysis, Management, Project Management, Computer Science",2
569,GRC Cybersecurity Specialist,SMART Technology Solutions,SaudiArabia,Makkah,Full Time,Not Specified,Not specified,Not Specified,"IT/Software Development, Marketing/PR/Advertising, Engineering - Telecom/Technology, information technology (it), computer engineering, computer science, ftp, cism, cissp, grc",2
570,Sr Account Manager/ Manager - Edelman,PrecisionHire Solutions,SaudiArabia,Riyadh,Full Time,Not Specified,Experienced,Not Specified,"Customer Service/Support, Marketing/PR/Advertising, Sales/Retail, Sales, Sales Skills, Customer Service, Sales Target, Customer Support, Customer Care, Account Management",1
571,Product Designer - Sonorbi - Suadeo,PrecisionHire Solutions,UnitedArabEmirates,Dubai,Full Time,Not Specified,Entry Level,Not Specified,"Creative/Design/Art, IT/Software Development, Engineering - Telecom/Technology, Design, Product Design, Adobe Photoshop, Applied Arts, Adobe Illustrator, Engineering, Information Technology (IT)",2
572,Product Manager - GEWISS,PrecisionHire Solutions,UnitedArabEmirates,Dubai,Full Time,Not Specified,Entry Level,Not Specified,"IT/Software Development, Marketing/PR/Advertising, Sales/Retail, Product Management, Marketing, Sales, Information Technology (IT), Computer Science, Project Management, Sales Skills",1
573,Senior Graphic Designer,Rize | رايز,Egypt,Cairo,Full Time,Not Specified,Experienced,Not Specified,"Creative/Design/Art, Marketing/PR/Advertising, Media/Journalism/Publishing, Graphic Design, Adobe Photoshop, Design, Adobe Illustrator, Adobe Indesign, Social Media, Marketing",2
574,Quality control,Foodies Block,Egypt,Cairo,Full Time,Not Specified,Entry Level,Not Specified,"IT/Software Development, Quality, Engineering - Telecom/Technology, Quality Control, Quality Assurance, Quality, Engineering, QC, Computer Science, Information Technology (IT)",0
575,Service Delivery Engineer,BigID,UnitedArabEmirates,Dubai,Full Time,Not Specified,Not specified,Not Specified,"Installation/Maintenance/Repair, Engineering - Telecom/Technology, Engineering - Mechanical/Electrical, Engineering, Information Technology (IT), Customer Service, Electrical Engineering, Computer Science, Maintenance, Mechanical Engineering",0
576,Solution Consultant @ KSA,China Mobile International Limited,SaudiArabia,Riyadh,Full Time,Not Specified,Experienced,Not Specified,"IT/Software Development, Sales/Retail, Engineering - Telecom/Technology, Information Technology (IT), Computer Science, Sales, Sales Skills, ERP, Engineering, Customer Service",1
577,Business Analyst,Careem,UnitedArabEmirates,Dubai,Full Time,Not Specified,Not specified,Not Specified,"IT/Software Development, Analyst/Research, Engineering - Telecom/Technology, Business Analysis, Information Technology (IT), Computer Science, Analysis, Software Development, Software, Computer Engineering",0
578,People Operations Specialist,Hempel A/S,Qatar,Doha,Full Time,Not Specified,Entry Level,Not Specified,"Customer Service/Support, Logistics/Supply Chain, Operations/Management, Operations, Customer Service, Logistics, Customer Support, Customer Care, Microsoft Office, Administration",1
579,R&D Operations Assistant,Reckitt Benckiser,UnitedArabEmirates,Dubai,Full Time,Not Specified,Not specified,Not Specified,"R&D/Science, IT/Software Development, Engineering - Telecom/Technology, R&amp;D, Science, Engineering, Information Technology (IT), Computer Science, Research, Pharmacy",0
580,Business Development Manager - Central Asia (with a knowledge of the Russian language),Cummins Inc.,UnitedArabEmirates,Dubai,Full Time,Not Specified,Experienced,Not Specified,"Business Development, Marketing/PR/Advertising, Sales/Retail, Business Development, Sales, Sales Skills, Sales Target, Marketing, Customer Service, Customer Support",1
581,IT Audit Section Head,ElsewedyElectric,Egypt,Cairo,Full Time,Not Specified,Not specified,Not Specified,"Accounting/Finance, IT/Software Development, Engineering - Telecom/Technology, Information Technology (IT), Finance, Accounting, Auditing, Computer Science, Internal Audit, Commerce",2
582,Applied Scientist - NLP,Core42,UnitedArabEmirates,Dubai,Full Time,Not Specified,Entry Level,Not Specified,"IT/Software Development, Analyst/Research, Engineering - Telecom/Technology, computer science, python, information technology (it), machine learning, engineering, algorithms, natural language processing",2
583,Quality Assurance Officer (Healthcare Accreditation Specialist),Skills Hub Recruitment Solutions,UnitedArabEmirates,Dubai,Full Time,Not Specified,Entry Level,Not Specified,"IT/Software Development, Quality, Engineering - Telecom/Technology, Quality Assurance, Quality Control, Quality, QA, Computer Science, Engineering, QC",2
584,Activities Manager (School - Sport & Non Sport),Fortes Holdings,UnitedArabEmirates,Dubai,Full Time,Not Specified,Entry Level,Not Specified,"Marketing/PR/Advertising, Project/Program Management, Engineering - Telecom/Technology, Project Management, Management, Administration, Marketing, Engineering, Education, Computer Engineering",2
585,Junior Business Analyst,SMART Technology Solutions,SaudiArabia,Makkah,Full Time,Not Specified,Entry Level,Not Specified,"IT/Software Development, Analyst/Research, Engineering - Telecom/Technology, Business Analysis, Information Technology (IT), Computer Science, Analysis, Software Development, Software, Engineering",0
586,AI Product Manager,Adecco,UnitedArabEmirates,Dubai,Full Time,Not Specified,Not specified,Not Specified,"IT/Software Development, Marketing/PR/Advertising, Project/Program Management, Product Management, Marketing, Sales, Information Technology (IT), Computer Science, Project Management, Market Research",1
587,"Senior Product Manager - Rides Platform, Customer Experience",Careem,UnitedArabEmirates,Dubai,Full Time,Not Specified,Not specified,Not Specified,"IT/Software Development, Marketing/PR/Advertising, Sales/Retail, Sales, Marketing, Information Technology (IT), Sales Skills, Project Management, Product Management, Computer Science",1
588,Senior Manager - Privacy & Protection (DPO) - Risk Management,D360 Bank,SaudiArabia,Riyadh,Full Time,Not Specified,Experienced,Not Specified,"IT/Software Development, Project/Program Management, Sales/Retail, Sales, Sales Skills, Customer Service, Project Management, Marketing, Information Technology (IT), Customer Support",1
589,dss+ - Subject Matter Expert - Process Safety Management,dss+,Qatar,Doha,Full Time,Not Specified,Experienced,Not Specified,"IT/Software Development, Analyst/Research, Engineering - Telecom/Technology, Information Technology (IT), DSS, Computer Science, PCI, Information Security, NIST, Engineering",0
590,Sr. Testing Engineer,DXC Technology,Egypt,Cairo,Full Time,Not Specified,Experienced,Not Specified,"IT/Software Development, Quality, Engineering - Telecom/Technology, Information Technology (IT), Computer Science, Software Testing, Engineering, Testing, Quality Control, Software Development",0
591,Sr Key Account Specialist Dammam,Dexcom,SaudiArabia,Riyadh,Full Time,Not Specified,Not specified,Not Specified,"Customer Service/Support, Sales/Retail, Pharmaceutical, Sales, Sales Skills, Customer Service, Customer Support, Account Management, Medical, Science",1
592,Senior Manager Shared Services,First Access Consulting,SaudiArabia,Riyadh,Full Time,Not Specified,Manager,Not Specified,"Accounting/Finance, IT/Software Development, Project/Program Management, Project Management, Management, Microsoft Office, Finance, Accounting, Computer Science, Information Technology (IT)",2
593,SCADA Telecom Engineer (Saudi National),Thales Group,SaudiArabia,Riyadh,Full Time,Not Specified,Not specified,Not Specified,"IT/Software Development, Engineering - Telecom/Technology, Engineering - Mechanical/Electrical, Engineering, Telecommunication, Information Technology (IT), Computer Science, Electrical Engineering, Maintenance, Metro",0
594,Infrastructure BIM Engineer,ASSYSTEM,SaudiArabia,Khobar,Full Time,Not Specified,Not specified,Not Specified,"Engineering - Construction/Civil/Architecture, IT/Software Development, Engineering - Telecom/Technology, Engineering, Information Technology (IT), Infrastructure, Computer Science, BIM, Civil Engineering, Construction",0
595,Talent Acquisition Manager Middle East & Africa - NOV Inc.,PrecisionHire Solutions,SaudiArabia,Riyadh,Full Time,Not Specified,Experienced,Not Specified,"Human Resources, IT/Software Development, Sales/Retail, Human Resources (HR), Recruitment, Sales, Information Technology (IT), Sales Skills, Computer Science, Talent Acquisition",2
596,Senior MEP Manager,"Jones Lang LaSalle IP, Inc",SaudiArabia,Riyadh,Full Time,Not Specified,Not specified,Not Specified,"IT/Software Development, Project/Program Management, Sales/Retail, Sales, Sales Skills, Customer Service, Project Management, Engineering, Marketing, Information Technology (IT)",1
597,Logistics Information System (LIS) Operator II (Maintenance),Amentum,Kuwait,Kuwait City,Full Time,Not Specified,Entry Level,Not Specified,"Installation/Maintenance/Repair, IT/Software Development, Engineering - Telecom/Technology, Information Technology (IT), Computer Science, ERP, Engineering, Software Engineering, Information Systems, Software",0
598,Senior Staff Nurse - American Hospital Khawaneej Clinic,American Hospital Dubai,UnitedArabEmirates,Dubai,Full Time,Not Specified,Experienced,Not Specified,"IT/Software Development, Sales/Retail, Engineering - Telecom/Technology, microsoft office, sales, information technology (it), computer science, customer service, management, medical",1
599,TS Controller (Cyber Security and Risk Management),Hamad International Airport,Qatar,Doha,Full Time,Not Specified,Entry Level,Not Specified,"IT/Software Development, Quality, Engineering - Telecom/Technology, computer science, information technology (it), javascript, c#, design, iso",0
600,SCADA Telecom Engineer (Saudi National),Thales,SaudiArabia,Riyadh,Full Time,Not Specified,Not specified,Not Specified,"IT/Software Development, Engineering - Telecom/Technology, Engineering - Mechanical/Electrical, Engineering, Telecommunication, Information Technology (IT), Computer Science, Electrical Engineering, Maintenance, Metro",0
601,Lead BIM Structural Designer,AtkinsRéalis,Egypt,Cairo,Full Time,Not Specified,Entry Level,Not Specified,"Engineering - Construction/Civil/Architecture, IT/Software Development, Engineering - Telecom/Technology, computer science, information technology (it), engineering, software development, design, civil engineering, architecture",0
602,Intern- Strategic Consulting,"Jones Lang LaSalle IP, Inc",SaudiArabia,Riyadh,Full Time,Not Specified,Not specified,Not Specified,"Accounting/Finance, IT/Software Development, Medical/Healthcare, Accounting, Commerce, Computer Science, Finance, Information Technology (IT), CIA, CPA",2
603,Interactive Designer – UX Designer,Austin Werner,UnitedArabEmirates,Dubai,Full Time,Not Specified,Entry Level,Not Specified,"Creative/Design/Art, IT/Software Development, Engineering - Telecom/Technology, Information Technology (IT), UX, Design, UI, Computer Science, Adobe Illustrator, Adobe Photoshop",2
604,Engineer I - Kitchen Technician,Rosewood Abu Dhabi,UnitedArabEmirates,Dubai,Full Time,Not Specified,Entry Level,Not Specified,"IT/Software Development, Engineering - Telecom/Technology, Engineering - Mechanical/Electrical, Information Technology (IT), Computer Science, Engineering, Software Engineering, Software Development, Computer Engineering, Oracle",0
605,"Cyber Threat Intelligence Consultant, Mandiant",Google,UnitedArabEmirates,Dubai,Full Time,Not Specified,Not specified,Not Specified,"IT/Software Development, Analyst/Research, Engineering - Telecom/Technology, information technology (it), computer science, itil, cissp, security, cyber security, networking",2
606,Quality Control Testing Specialist,Grifols Egypt for Plasma Derivatives (GEPD),Egypt,Cairo,Full Time,Not Specified,Entry Level,Not Specified,"R&D/Science, IT/Software Development, Quality, Quality Control, Quality Assurance, Quality, QC, QA, Science, Engineering",2
607,Software Engineer Backend,Trella,Egypt,Cairo,Full Time,Not Specified,Entry Level,Not Specified,"IT/Software Development, Quality, Engineering - Telecom/Technology, Information Technology (IT), Computer Science, Software Development, Software Engineering, Engineering, Computer Engineering, Software",0
608,"Senior Analyst, Quality Engineering",S.C. Johnson & Son Inc,Egypt,Cairo,Full Time,Not Specified,Not specified,Not Specified,"IT/Software Development, Quality, Engineering - Telecom/Technology, Quality Control, Computer Science, Information Technology (IT), Quality Assurance, Software Testing, Software Development, Software Engineering",0
609,Proposal Technical Writer.,AZAR Human Resource Solutions,SaudiArabia,Riyadh,Full Time,Not Specified,Experienced,Not Specified,"Writing/Editorial, IT/Software Development, Engineering - Telecom/Technology, Information Technology (IT), Technical Writing, Writing, Computer Science, Microsoft Office, Documentation, English",2
610,Information Communication and Technology Consultant,Frost & Sullivan,SaudiArabia,Riyadh,Full Time,Not Specified,Experienced,Not Specified,"Installation/Maintenance/Repair, IT/Software Development, Engineering - Telecom/Technology, Information Technology (IT), Computer Science, Communication Skills, Accounting, ERP, Engineering, Odoo",0
611,Chemistry Lab Instructor,University of Doha for Science & Technology,Qatar,Doha,Full Time,Not Specified,Entry Level,Not Specified,"R&D/Science, Quality, Engineering - Other, chemistry, science, quality, quality control, engineering, laboratory, lab",2
612,"Cluster Security Manager (Saudi Arabian/GCC national), DCC Communities",Amazon Web Services (AWS),SaudiArabia,Riyadh,Full Time,Not Specified,Experienced,Not Specified,"Administration, Legal, Operations/Management, Security, Administration, Information Technology (IT), Legal, Management, Police, Engineering",2
613,Commerce Cloud Solution Engineer - Dubai,Salesforce,UnitedArabEmirates,Dubai,Full Time,Not Specified,Not specified,Not Specified,"IT/Software Development, Sales/Retail, Engineering - Telecom/Technology, Computer Science, Information Technology (IT), Engineering, Cloud, Computer Engineering, Presales, B2B",0
614,Middle Product Manager,Snoonu,Qatar,Doha,Full Time,Not Specified,Entry Level,Not Specified,"IT/Software Development, Marketing/PR/Advertising, Project/Program Management, Product Management, Marketing, Sales, Information Technology (IT), Computer Science, Project Management, Sales Skills",1
615,Team Leader | Nike.com | Kuwait,GMG,Kuwait,Kuwait City,Full Time,Not Specified,Experienced,Not Specified,"IT/Software Development, Sales/Retail, Engineering - Telecom/Technology, computer science, information technology (it), computer engineering, sales, customer service, microsoft office, operations",1
616,Team Leader | Nike.com | Qatar,GMG,Qatar,Doha,Full Time,Not Specified,Experienced,Not Specified,"IT/Software Development, Sales/Retail, Engineering - Telecom/Technology, computer science, information technology (it), computer engineering, sales, customer service, microsoft office, operations",1
617,Internal Medical Translator - English into Arabic (Arabic native speaker),IQVIA,Egypt,Cairo,Full Time,Not Specified,Not specified,Not Specified,"Writing/Editorial, Medical/Healthcare, Pharmaceutical, Translation, Pharmacy, Medical, Science, Biotechnology, Medicine, Writing",2
618,Senior CRM Specialist,WalaPlus,SaudiArabia,Riyadh,Full Time,Not Specified,Experienced,Not Specified,"Human Resources, Marketing/PR/Advertising, Media/Journalism/Publishing, Marketing, Social Media, Human Resources (HR), E-marketing, Microsoft Office, Digital Marketing, Media",2
619,Director | Financial Services,Deloitte,SaudiArabia,Riyadh,Full Time,Not Specified,Manager,Not Specified,"Accounting/Finance, Customer Service/Support, Sales/Retail, Finance, Accounting, Commerce, Microsoft Office, Financial Analysis, Financial Management, CPA",2
620,Key Account Manager,Dailymealz | ديلي ميلز,SaudiArabia,Riyadh,Full Time,Not Specified,Experienced,Not Specified,"Business Development, Customer Service/Support, Sales/Retail, Sales, Sales Skills, Customer Service, Sales Target, Customer Support, Customer Care, Account Management",1
621,Key Account Manager,Sanofi,UnitedArabEmirates,Dubai,Full Time,Not Specified,Not specified,Not Specified,"Business Development, Customer Service/Support, Sales/Retail, Sales, Sales Skills, Customer Service, Sales Target, Customer Support, Customer Care, Account Management",1
622,Scientific Application Specialist - Mass spectrometry (MS) / Liquid chromatography (LC).,AB Sciex,SaudiArabia,Riyadh,Full Time,Not Specified,Not specified,Not Specified,"Installation/Maintenance/Repair, IT/Software Development, Engineering - Telecom/Technology, Information Technology (IT), Computer Science, SQL, Application Support, Software Development, Computer Engineering, Software Engineering",0
623,Associate Clinical Application - Blood Gas & Immunoassay (Jeddah),Radiometer Medical ApS,SaudiArabia,Jeddah,Full Time,Not Specified,Not specified,Not Specified,"IT/Software Development, Medical/Healthcare, Analyst/Research, Medical, Information Technology (IT), B2B, Computer Science, Healthcare, Radioloigy, Research",2
624,Senior Financial Analyst,Abbott,Egypt,Cairo,Full Time,Not Specified,Not specified,Not Specified,"Accounting/Finance, IT/Software Development, Analyst/Research, Finance, Accounting, Financial Analysis, Information Technology (IT), Analysis, Computer Science, Business Analysis",2
625,"Analyst, Emerging Technologies",ROSHN l روشن,SaudiArabia,Riyadh,Full Time,Not Specified,Experienced,Not Specified,"Accounting/Finance, IT/Software Development, Analyst/Research, Computer Science, Information Technology (IT), Accounting, FInance, Engineering, Blockchain, Commerce",2
626,Senior Front-end Engineer - ReactJS / Trading Systems,Austin Werner,UnitedArabEmirates,Dubai,Full Time,Not Specified,Experienced,Not Specified,"Creative/Design/Art, IT/Software Development, Engineering - Telecom/Technology, Information Technology (IT), Computer Science, Software Development, javaScript, CSS, HTML5, HTML",0
627,Systems & Database Director,"Zakat, Tax and Customs Authority",SaudiArabia,Riyadh,Full Time,Not Specified,Manager,Not Specified,"Installation/Maintenance/Repair, IT/Software Development, Engineering - Telecom/Technology, Information Technology (IT), Computer Science, Engineering, Computer Engineering, System Administration, Software Engineering, Microsoft Office",0
628,Senior Financial Analyst,McLedger,Egypt,Cairo,Full Time,Not Specified,Not specified,Not Specified,"Accounting/Finance, IT/Software Development, Analyst/Research, Finance, Accounting, Financial Analysis, Information Technology (IT), Analysis, Computer Science, Business Analysis",2
