,job_title,company_name,country,city,job_type,work_location,experience_level,yrs_exp,industry_and_skills,label
874,Business Strategy Senior Manager- Products,Accenture Middle East,SaudiArabia,Riyadh,Full Time,Not Specified,Experienced,Not Specified,"Business Development, Marketing/PR/Advertising, Project/Program Management, Marketing, Sales, Business Development, Product Management, Business Planning, Project Management, Computer Science",1
875,Sr Key Account Specialist- Jeddah,Dexcom,SaudiArabia,Riyadh,Full Time,Not Specified,Not specified,Not Specified,"Customer Service/Support, Sales/Retail, Pharmaceutical, Sales, Sales Skills, Customer Service, Customer Support, Customer Care, Account Management, Medical",1
876,Monitoring and Evaluation Specialist – Egypt – USAID Teacher Excellence Initiative Activity,Education Development Center,Egypt,Cairo,Full Time,Not Specified,Not specified,Not Specified,"Marketing/PR/Advertising, Project/Program Management, Education/Teaching, microsoft office, marketing, project management, education, management, teaching, english",2
877,Maintenance Team Leader,AtkinsRéalis,Qatar,Doha,Full Time,Not Specified,Experienced,Not Specified,"IT/Software Development, Sales/Retail, Engineering - Telecom/Technology, Sales, Sales Skills, Sales Target, Information Technology (IT), Computer Science, Customer Service, Real Estate",1
878,Business Process Manager - AFMEI,LyondellBasell,UnitedArabEmirates,Dubai,Full Time,Not Specified,Experienced,Not Specified,"Business Development, Marketing/PR/Advertising, Sales/Retail, Business Development, Sales, Sales Skills, Marketing, Sales Target, Management, Customer Service",1
879,NUPCO Account Specialist,Beckman Coulter,SaudiArabia,Riyadh,Full Time,Not Specified,Not specified,Not Specified,"Customer Service/Support, Sales/Retail, Pharmaceutical, Sales, Customer Service, Customer Support, Sales Skills, Customer Care, Sales Target, Account Management",1
880,Technical Service Engineer (Field),Eastman,UnitedArabEmirates,Dubai,Full Time,Not Specified,Entry Level,Not Specified,"Engineering - Construction/Civil/Architecture, Engineering - Telecom/Technology, Engineering - Mechanical/Electrical, Engineering, AutoCAD, Information Technology (IT), Technical Office, Computer Science, Technical Support, Customer Service",0
881,Learning & Development Manager- Hospitality,The First Group,UnitedArabEmirates,Dubai,Full Time,Not Specified,Experienced,Not Specified,"IT/Software Development, Engineering - Telecom/Technology, Education/Teaching, Education, Learning, Training, Information Technology (IT), Computer Science, Teaching, E-Learning",2
882,Senior Outsystem Engineer,Adree,Egypt,Cairo,Full Time,Not Specified,Not specified,Not Specified,"IT/Software Development, Engineering - Telecom/Technology, Engineering - Mechanical/Electrical, Engineering, Information Technology (IT), Computer Science, Software Engineering, Software Development, Computer Engineering, Mechanical Engineering",0
883,Process Engineer - Sulfur Recovery Sour Water Stripper,ICM People do Brasil,SaudiArabia,Riyadh,Full Time,Not Specified,Entry Level,Not Specified,"IT/Software Development, Engineering - Telecom/Technology, Engineering - Mechanical/Electrical, Engineering, Computer Science, Information Technology (IT), Mechanical Engineering, Production, Software Engineering, Software Development",0
884,Monitoring and Evaluation Specialist – Egypt – USAID Teacher Excellence Initiative Activity,EDC (Education Development Center),Egypt,Cairo,Full Time,Not Specified,Experienced,Not Specified,"Marketing/PR/Advertising, Project/Program Management, Education/Teaching, microsoft office, marketing, project management, education, management, teaching, english",2
885,Frontend Developer - Jeddah,Lucidya LLC.,SaudiArabia,Jeddah,Full Time,Not Specified,Not specified,Not Specified,"Creative/Design/Art, IT/Software Development, Engineering - Telecom/Technology, Information Technology (IT), Computer Science, Software Development, javaScript, CSS, Front-End, HTML",0
886,Fullstack Developer - Django & React,TalPods,Egypt,Cairo,Full Time,Not Specified,Experienced,Not Specified,"Creative/Design/Art, IT/Software Development, Engineering - Telecom/Technology, Information Technology (IT), Computer Science, Software Development, javaScript, HTML, Software Engineering, CSS",0
887,dss+ - Sustainability Consultant,dss+,UnitedArabEmirates,Dubai,Full Time,Not Specified,Experienced,Not Specified,"IT/Software Development, Analyst/Research, Engineering - Telecom/Technology, Information Technology (IT), DSS, Computer Science, PCI, Information Security, NIST, Engineering",0
888,"Account Manager, Partnerships",160over90,UnitedArabEmirates,Dubai,Full Time,Not Specified,Entry Level,Not Specified,"Customer Service/Support, Marketing/PR/Advertising, Sales/Retail, Sales, Sales Skills, Customer Service, Sales Target, Customer Support, Customer Care, Account Management",1
889,Operations Support Event management National Consultant,United Nations Population Fund (UNFPA),Egypt,Cairo,Freelance / Project,Not Specified,Experienced,Not Specified,"IT/Software Development, Sales/Retail, Engineering - Telecom/Technology, sales, information technology (it), sales skills, computer science, administration, management, operations",1
890,Front-End Developer,Jadeer,Egypt,Cairo,Full Time,Not Specified,Entry Level,Not Specified,"Creative/Design/Art, IT/Software Development, Engineering - Telecom/Technology, Information Technology (IT), Computer Science, Software Development, javaScript, CSS, HTML, Software Engineering",0
891,Security - CCTV Operator,Sofitel Marrakech,UnitedArabEmirates,Ras al-Khaimah,Full Time,Not Specified,Entry Level,Not Specified,"Installation/Maintenance/Repair, IT/Software Development, Engineering - Telecom/Technology, Information Technology (IT), Computer Science, Security, Engineering, Computer Engineering, Networking, Software Engineering",0
892,Senior CRM Specialist,Adree,Egypt,Cairo,Full Time,Not Specified,Not specified,Not Specified,"Human Resources, Marketing/PR/Advertising, Media/Journalism/Publishing, Marketing, Social Media, Human Resources (HR), E-marketing, Microsoft Office, Digital Marketing, Media",2
893,Business Intelligence Team Lead,Jadeer,Egypt,Cairo,Full Time,Not Specified,Experienced,Not Specified,"IT/Software Development, Sales/Retail, Engineering - Telecom/Technology, sales, sales skills, information technology (it), computer science, engineering, management, project management",1
894,Test Analyst - SAP Systems (Arabic speakers preferred),Trans Skills LLC,UnitedArabEmirates,Dubai,Full Time,Not Specified,Entry Level,Not Specified,"IT/Software Development, Analyst/Research, Engineering - Telecom/Technology, Information Technology (IT), Software Testing, Computer Science, Testing, Analyst, Software, Software Engineering",0
895,F&B Area Manager,AWJ,UnitedArabEmirates,Dubai,Full Time,Not Specified,Experienced,Not Specified,"Hospitality/Hotels/Food Services, Sales/Retail, Engineering - Telecom/Technology, F&amp;B, Sales, Sales Skills, Information Technology (IT), Customer Service, Microsoft Office, Food &amp; Beverage",1
896,Software Engineer - Backend (Jeddah),Lucidya LLC.,SaudiArabia,Jeddah,Full Time,Not Specified,Not specified,Not Specified,"IT/Software Development, Quality, Engineering - Telecom/Technology, Information Technology (IT), Computer Science, Software Development, Software Engineering, Engineering, Computer Engineering, Software",0
897,Control and Reporting Lead (French Speaker),Pepsi,Egypt,Cairo,Full Time,Not Specified,Not specified,Not Specified,"IT/Software Development, Quality, Engineering - Telecom/Technology, Computer Science, Information Technology (IT), Startup, Testing, Automation, Engineering, Quality Control",0
898,Team Leader - Operations,cartier,UnitedArabEmirates,Dubai,Full Time,Not Specified,Not specified,Not Specified,"IT/Software Development, Sales/Retail, Engineering - Telecom/Technology, Sales, Sales Skills, Information Technology (IT), Sales Target, Computer Science, Customer Service, Real Estate",1
899,System Administrator - Jeddah,Lucidya LLC.,SaudiArabia,Jeddah,Full Time,Not Specified,Not specified,Not Specified,"Installation/Maintenance/Repair, IT/Software Development, Engineering - Telecom/Technology, Information Technology (IT), Computer Science, System Administration, Engineering, Linux, Installation, Computer Engineering",0
900,Account Management Director - SaaS Products,Jadeer,Egypt,Cairo,Freelance / Project,Not Specified,Manager,Not Specified,"Customer Service/Support, Marketing/PR/Advertising, Sales/Retail, Sales, Sales Skills, Customer Service, Sales Target, Customer Support, Customer Care, Account Management",1
901,Senior PPC Specialist,Future Group Translation Services,Egypt,Cairo,Full Time,Not Specified,Experienced,Not Specified,"Human Resources, Marketing/PR/Advertising, Media/Journalism/Publishing, Marketing, Social Media, Human Resources (HR), E-marketing, Microsoft Office, Digital Marketing, Media",2
902,Sustainability Associate Manager,Pepsi,Egypt,Cairo,Full Time,Not Specified,Not specified,Not Specified,"IT/Software Development, Project/Program Management, Engineering - Telecom/Technology, Project Management, PMP, Information Technology (IT), Computer Science, Marketing, Engineering, Microsoft Office",0
903,GPPRR Management Specialist,Beckman Coulter,SaudiArabia,Riyadh,Full Time,Not Specified,Not specified,Not Specified,"Customer Service/Support, Human Resources, Marketing/PR/Advertising, Customer Service, Marketing, Microsoft Office, Project Management, Human Resources (HR), Customer Support, English",1
904,Partner Certification Leader,Orange,Egypt,Cairo,Full Time,Not Specified,Not specified,Not Specified,"IT/Software Development, Sales/Retail, Engineering - Telecom/Technology, information technology (it), computer science, engineering, sales, marketing, management, agile",0
905,MLOps Engineer - LLM and GenAI Products,Merck Group,Egypt,Cairo,Full Time,Not Specified,Experienced,Not Specified,"IT/Software Development, Engineering - Telecom/Technology, ai, artificial intelligence, azure, c#, cloud, computer science, deployment, engineering",2
906,Quality Assurance Specialist,Future Group Translation Services,Egypt,Cairo,Full Time,Not Specified,Entry Level,Not Specified,"IT/Software Development, Quality, Engineering - Telecom/Technology, Quality Assurance, Quality Control, Quality, QA, QC, Engineering, Science",2
907,On-Site Service Machinist,GE Vernova,Egypt,Cairo,Full Time,Not Specified,Entry Level,Not Specified,"Installation/Maintenance/Repair, IT/Software Development, Engineering - Telecom/Technology, information technology (it), engineering, computer science, customer service, quality, site, service",0
908,Project Engineer - Water & Wastewater,GSEC,Egypt,Cairo,Full Time,Not Specified,Not specified,Not Specified,"Engineering - Construction/Civil/Architecture, Project/Program Management, Engineering - Mechanical/Electrical, Project Management, Engineering, Civil Engineering, Construction, Information Technology (IT), Computer Science, Architecture",2
909,Strategic Development Specialist,iHR (International Human Resources),SaudiArabia,Riyadh,Full Time,Not Specified,Experienced,Not Specified,"Business Development, Marketing/PR/Advertising, Sales/Retail, Business Development, Sales, Sales Skills, Sales Target, Marketing, Customer Service, Microsoft Office",1
910,PMO Manager,Kinetic Business Solutions,SaudiArabia,Riyadh,Full Time,Not Specified,Entry Level,Not Specified,"IT/Software Development, Project/Program Management, Engineering - Telecom/Technology, Project Management, PMO, PMP, Information Technology (IT), Computer Science, Computer Engineering, Microsoft Office",0
911,Senior Business Analyst,Tech Integrated Services,Egypt,Cairo,Full Time,Not Specified,Not specified,Not Specified,"IT/Software Development, Analyst/Research, Engineering - Telecom/Technology, Information Technology (IT), Business Analysis, Computer Science, Analysis, Business Development, Sales, Sales Skills",0
912,Senior Backend Developer PHP / WordPress,Shahbandr,Egypt,Cairo,Full Time,Not Specified,Entry Level,Not Specified,"Creative/Design/Art, IT/Software Development, Engineering - Telecom/Technology, Information Technology (IT), PHP, Computer Science, Software Development, javaScript, Laravel, MySQL",0
913,Head Full Stride Cloud,Wipro,UnitedArabEmirates,Dubai,Full Time,Not Specified,Not specified,Not Specified,"IT/Software Development, Engineering - Telecom/Technology, Engineering - Mechanical/Electrical, information technology (it), computer science, python, computer engineering, aws, html, agile",0
914,Artificial Intelligence Engineer,iHR (International Human Resources),SaudiArabia,Riyadh,Full Time,Not Specified,Experienced,Not Specified,"IT/Software Development, Analyst/Research, Engineering - Telecom/Technology, Artificial Intelligence, Computer Science, Information Technology (IT), Software Engineering, Computer Engineering, Software Development, Engineering",0
915,Project Manager,Lucidya,SaudiArabia,Riyadh,Full Time,Not Specified,Not specified,Not Specified,"Engineering - Construction/Civil/Architecture, IT/Software Development, Project/Program Management, Project Management, Engineering, Information Technology (IT), Management, Computer Science, Civil Engineering, Microsoft Office",0
916,Platform Reliability Engineer,BHFT,UnitedArabEmirates,Dubai,Full Time,Not Specified,Not specified,Not Specified,"Installation/Maintenance/Repair, IT/Software Development, Engineering - Telecom/Technology, Engineering, Computer Science, Information Technology (IT), AWS, DevOps, Maintenance, B2B",0
917,ERP Technical Support Consultant (Microsoft Dynamics 365) - KSA Based,Jadeer,SaudiArabia,Riyadh,Full Time,Not Specified,Experienced,Not Specified,"Customer Service/Support, IT/Software Development, Engineering - Telecom/Technology, Technical Support, Customer Support, Customer Service, ERP, Computer Science, Customer Care, Information Technology (IT)",1
918,Senior Software Project Manager,Jadeer,Egypt,Cairo,Full Time,Not Specified,Experienced,Not Specified,"IT/Software Development, Project/Program Management, Engineering - Telecom/Technology, Project Management, Information Technology (IT), Computer Science, PMP, Software Development, Software, Software Engineering",0
919,"DESIGN MANAGER - COMMERCIAL OFFICES, MUSEUM & EXHIBITION",Jobs for Humanity,SaudiArabia,Riyadh,Full Time,Not Specified,Not specified,Not Specified,"Engineering - Construction/Civil/Architecture, Creative/Design/Art, IT/Software Development, Design, Project Management, Engineering, Architecture, Management, Information Technology (IT), Marketing",2
920,Sr. Executive ISM,Reliance Human Resources Consultancy,UnitedArabEmirates,Dubai,Full Time,Not Specified,Experienced,Not Specified,"IT/Software Development, Project/Program Management, Engineering - Telecom/Technology, information technology (it), computer science, engineering, microsoft office, quality, marine, qhse",0
921,Production Supervisor (BOP Repair Services),Mazrui International,UnitedArabEmirates,Dubai,Full Time,Not Specified,Experienced,Not Specified,"Manufacturing/Production, Pharmaceutical, Engineering - Other, Production, Manufacturing, Engineering, Pharmacy, Science, Pharmaceutical, Quality",2
922,Product Manager - Jumia (Full Time),Jumia Group,Egypt,Cairo,Full Time,Not Specified,Entry Level,Not Specified,"IT/Software Development, Marketing/PR/Advertising, Sales/Retail, Product Management, Marketing, Sales, Information Technology (IT), Computer Science, Project Management, Sales Skills",1
923,Senior Product Manager - Jumia (Full Time),Jumia Group,Egypt,Cairo,Full Time,Not Specified,Experienced,Not Specified,"IT/Software Development, Marketing/PR/Advertising, Sales/Retail, Sales, Marketing, Information Technology (IT), Sales Skills, Project Management, Product Management, Computer Science",1
924,Technical Sales Engineer,Belimo,UnitedArabEmirates,Dubai,Full Time,Not Specified,Entry Level,Not Specified,"Engineering - Construction/Civil/Architecture, Sales/Retail, Engineering - Mechanical/Electrical, Engineering, Sales, Sales Skills, Sales Target, Electrical Engineering, Mechanical Engineering, AutoCAD",1
925,Senior Business Analyst,InfoVision Inc.,UnitedArabEmirates,Dubai,Full Time,Not Specified,Experienced,Not Specified,"IT/Software Development, Analyst/Research, Engineering - Telecom/Technology, Information Technology (IT), Business Analysis, Computer Science, Analysis, Business Development, Sales, Sales Skills",0
926,"Sales Representative, Equipment Trading",Saudi Diesel Equipment Company,SaudiArabia,Riyadh,Full Time,Not Specified,Entry Level,Not Specified,"Customer Service/Support, Medical/Healthcare, Sales/Retail, Medical, Sales, Sales Skills, Sales Target, Customer Care, Customer Service, Customer Support",1
927,Senior Java Developer,Flow Talent,Egypt,Cairo,Full Time,Not Specified,Experienced,Not Specified,"Business Development, IT/Software Development, Engineering - Telecom/Technology, Information Technology (IT), Computer Science, Software Development, javaScript, Software Engineering, CSS, SQL",0
928,Business Development Manager - Africa and UAE - Cirium,LexisNexis Risk Solutions,UnitedArabEmirates,Dubai,Full Time,Not Specified,Experienced,Not Specified,"Business Development, Marketing/PR/Advertising, Sales/Retail, Business Development, Sales, Sales Skills, Sales Target, Marketing, Customer Service, Customer Support",1
929,Enterprise Network Engineer ( Remote),ServerHub,Egypt,Cairo,Full Time,Not Specified,Experienced,Not Specified,"Installation/Maintenance/Repair, IT/Software Development, Engineering - Telecom/Technology, Information Technology (IT), Computer Science, Engineering, Networking, CCNA, CCNP, Networks",0
930,Business Analyst,Truelancer.com,UnitedArabEmirates,Dubai,Full Time,Not Specified,Entry Level,Not Specified,"IT/Software Development, Analyst/Research, Engineering - Telecom/Technology, Business Analysis, Information Technology (IT), Computer Science, Analysis, Software Development, Software, Computer Engineering",0
931,Systems Integration Lead,Honeywell,Egypt,Cairo,Full Time,Not Specified,Experienced,Not Specified,"IT/Software Development, Project/Program Management, Engineering - Telecom/Technology, Computer Science, Information Technology (IT), Computer Engineering, Integration, Software Development, XML, Engineering",0
932,Engineering & Integrity General Manager,Dragon Oil,Egypt,Cairo,Full Time,Not Specified,Not specified,Not Specified,"IT/Software Development, Engineering - Telecom/Technology, Engineering - Mechanical/Electrical, Engineering, Information Technology (IT), Computer Science, Software Development, Software Engineering, Computer Engineering, Mechanical Engineering",0
933,Associate - External Audit (UAE Nationals),Grant Thornton,UnitedArabEmirates,Dubai,Full Time,Not Specified,Entry Level,Not Specified,"Business Development, Customer Service/Support, Sales/Retail, Sales Skills, Customer Service, Sales Target, Sales, Marketing, Outdoor Sales, Business Development",1
934,IT Performance Director,Core42,UnitedArabEmirates,Dubai,Full Time,Not Specified,Manager,Not Specified,"IT/Software Development, Operations/Management, Engineering - Telecom/Technology, Computer Science, Information Technology (IT), ITIL, Operations, Project Management, Engineering, IT Operations",0
935,Network Operations Engineer - Egypt,Juniper Networks,Egypt,Cairo,Full Time,Not Specified,Not specified,Not Specified,"Installation/Maintenance/Repair, IT/Software Development, Engineering - Telecom/Technology, Information Technology (IT), Computer Science, Engineering, Networking, CCNA, Networks, CCNP",0
936,Product Lifecycle Specialist IMETA,Boehringer Ingelheim,UnitedArabEmirates,Dubai,Full Time,Not Specified,Experienced,Not Specified,"IT/Software Development, Marketing/PR/Advertising, Engineering - Telecom/Technology, information technology (it), computer science, engineering, sales, product, english, analysis",0
937,Regional Development Manager,Pearson,UnitedArabEmirates,Dubai,Full Time,Not Specified,Not specified,Not Specified,"Business Development, Marketing/PR/Advertising, Sales/Retail, Sales, Business Development, Sales Skills, Sales Target, Marketing, Management, Customer Service",1
938,Project Manager - Digital Transformation,Saudia Dairy & Foodstuff Co.,SaudiArabia,Jeddah,Full Time,Not Specified,Not specified,Not Specified,"Engineering - Construction/Civil/Architecture, IT/Software Development, Project/Program Management, Project Management, Engineering, Information Technology (IT), Management, Computer Science, Civil Engineering, Microsoft Office",0
939,Database Administrator (DBA),DeepSource,SaudiArabia,Riyadh,Full Time,Not Specified,Not specified,Not Specified,"Installation/Maintenance/Repair, IT/Software Development, Engineering - Telecom/Technology, Information Technology (IT), Computer Science, SQL, Oracle, Database Administration, Database, Linux",0
940,Quality Front Line Assistant Manager,Pepsi,SaudiArabia,Riyadh,Full Time,Not Specified,Not specified,Not Specified,"IT/Software Development, Sales/Retail, Engineering - Telecom/Technology, information technology (it), engineering, computer science, microsoft office, sales, management, english",0
941,QA Lead,Morgan Advanced Materials,UnitedArabEmirates,Dubai,Full Time,Not Specified,Experienced,Not Specified,"IT/Software Development, Quality, Engineering - Telecom/Technology, information technology (it), computer science, quality assurance, qa, quality, engineering, qc",0
942,Product Lifecycle Specialist META,Boehringer Ingelheim,UnitedArabEmirates,Dubai,Full Time,Not Specified,Experienced,Not Specified,"IT/Software Development, Marketing/PR/Advertising, Engineering - Telecom/Technology, information technology (it), computer science, engineering, marketing, product, english, analysis",0
943,Project Manager Sr. Analyst,Pepsi,Egypt,Cairo,Full Time,Not Specified,Not specified,Not Specified,"IT/Software Development, Project/Program Management, Engineering - Telecom/Technology, Project Management, Information Technology (IT), Computer Science, PMP, Software Engineering, Telecommunication, Microsoft Office",0
944,Service Sales Support Engineer,Bühler Group,UnitedArabEmirates,Dubai,Full Time,Not Specified,Not specified,Not Specified,"Customer Service/Support, Sales/Retail, Engineering - Mechanical/Electrical, Customer Service, Sales, Customer Support, Customer Care, Sales Skills, Engineering, Sales Target",1
945,Backend Engineer,Abgad أبجد,Egypt,Cairo,Full Time,Not Specified,Entry Level,Not Specified,"Creative/Design/Art, IT/Software Development, Engineering - Telecom/Technology, Information Technology (IT), Computer Science, Software Development, Software Engineering, Back-End, Engineering, PHP",0
946,Thermal Insulation Specialist - Munitions Development,HALCON,UnitedArabEmirates,Dubai,Full Time,Not Specified,Entry Level,Not Specified,"Installation/Maintenance/Repair, IT/Software Development, Engineering - Telecom/Technology, information technology (it), computer science, engineering, mcse, software, quality assurance, quality control",0
947,Senior Specialist - Business Analysis,Core42,UnitedArabEmirates,Dubai,Full Time,Not Specified,Experienced,Not Specified,"Human Resources, Marketing/PR/Advertising, Media/Journalism/Publishing, Marketing, Social Media, Human Resources (HR), E-marketing, Microsoft Office, Digital Marketing, Media",2
948,Platform Architect – Conversational Commerce,Coca-Cola HBC,Egypt,Cairo,Full Time,Not Specified,Experienced,Not Specified,"IT/Software Development, Marketing/PR/Advertising, Media/Journalism/Publishing, marketing, social media, media, digital marketing, computer science, english, azure",2
949,Full-Stack Web Developer,inoi,UnitedArabEmirates,Dubai,Full Time,Not Specified,Not specified,Not Specified,"Creative/Design/Art, IT/Software Development, Engineering - Telecom/Technology, Information Technology (IT), Computer Science, Software Development, javaScript, HTML, CSS, Full Stack",0
950,Cyber Security Engineer,High5,UnitedArabEmirates,Dubai,Full Time,Not Specified,Experienced,Not Specified,"Installation/Maintenance/Repair, IT/Software Development, Engineering - Telecom/Technology, Information Technology (IT), Computer Science, Engineering, Security, Networking, Computer Engineering, Cisco",0
951,Backend Engineer,G42 Healthcare,UnitedArabEmirates,Dubai,Full Time,Not Specified,Entry Level,Not Specified,"Creative/Design/Art, IT/Software Development, Engineering - Telecom/Technology, Information Technology (IT), Computer Science, Software Development, Software Engineering, Back-End, Engineering, PHP",0
952,Service Program Manager II,Panasonic Avionics Corporation,UnitedArabEmirates,Dubai,Full Time,Not Specified,Experienced,Not Specified,"IT/Software Development, Operations/Management, Project/Program Management, Project Management, Information Technology (IT), Management, Program Management, Computer Science, VxBlock, VxRack",2
953,Chief Architect,M2,UnitedArabEmirates,Dubai,Full Time,Not Specified,Manager,Not Specified,"IT/Software Development, Engineering - Telecom/Technology, Engineering - Mechanical/Electrical, computer science, information technology (it), aws, computer engineering, docker, java, html",0
954,Developers,RedHolt,UnitedArabEmirates,Dubai,Full Time,Not Specified,Experienced,Not Specified,"Business Development, IT/Software Development, Engineering - Telecom/Technology, Information Technology (IT), Computer Science, Software Development, Software Engineering, Business Development, javaScript, Engineering",0
955,Well Testing Engineer Trainee,Rawabi United Safety Services Company Limited (RUSS),SaudiArabia,Riyadh,Full Time,Not Specified,Student,Not Specified,"IT/Software Development, Quality, Engineering - Telecom/Technology, information technology (it), computer science, software development, engineering, testing, communication skills, production",0
